{
  "Format": "3.0",
  "organisationCode": 0,
  "reference": "Kevin S",
  "clientDetails": [
    {
      "bdsNumber": 19,
      "value": "1"
    },
    {
      "bdsNumber": 20,
      "value": "19890214"
    },
    {
      "bdsNumber": 82,
      "value": 241
    },
    {
      "bdsNumber": 91,
      "value": "2"
    },
    {
      "bdsNumber": 110,
      "value": 1740
    },
    {
      "bdsNumber": 238,
      "value": 1680
    },
    {
      "bdsNumber": 240,
      "value": 1780
    }
  ],
  "clientMeasurements": [
    {
      "bdsNumber": 235,
      "values": [
        {
          "date": "19890214",
          "value": 430
        },
        {
          "date": "19890405",
          "value": 500
        },
        {
          "date": "19890419",
          "value": 515
        },
        {
          "date": "19890517",
          "value": 555
        },
        {
          "date": "19890816",
          "value": 650
        },
        {
          "date": "19891115",
          "value": 710
        },
        {
          "date": "19900221",
          "value": 755
        },
        {
          "date": "19900523",
          "value": 770
        },
        {
          "date": "19900821",
          "value": 810
        },
        {
          "date": "19910219",
          "value": 880
        }
      ]
    },
    {
      "bdsNumber": 245,
      "values": [
        {
          "date": "19890214",
          "value": 1740
        },
        {
          "date": "19890405",
          "value": 2880
        },
        {
          "date": "19890419",
          "value": 3280
        },
        {
          "date": "19890517",
          "value": 4170
        },
        {
          "date": "19890816",
          "value": 6220
        },
        {
          "date": "19891115",
          "value": 7310
        },
        {
          "date": "19900221",
          "value": 8240
        },
        {
          "date": "19900523",
          "value": 9000
        },
        {
          "date": "19900821",
          "value": 9550
        },
        {
          "date": "19910219",
          "value": 10900
        }
      ]
    },
    {
      "bdsNumber": 252,
      "values": [
        {
          "date": "19890214",
          "value": 320
        },
        {
          "date": "19890405",
          "value": 337
        },
        {
          "date": "19890419",
          "value": 346
        },
        {
          "date": "19890517",
          "value": 360
        },
        {
          "date": "19890816",
          "value": 393
        },
        {
          "date": "19891115",
          "value": 420
        },
        {
          "date": "19900221",
          "value": 431
        },
        {
          "date": "19900523",
          "value": 440
        },
        {
          "date": "19900821",
          "value": 440
        },
        {
          "date": "19910219",
          "value": 465
        }
      ]
    },
    {
      "bdsNumber": 879,
      "values": [
        {
          "date": "19890405",
          "value": "1"
        }
      ]
    },
    {
      "bdsNumber": 881,
      "values": [
        {
          "date": "19890405",
          "value": "2"
        },
        {
          "date": "19890419",
          "value": "2"
        },
        {
          "date": "19890517",
          "value": "1"
        }
      ]
    },
    {
      "bdsNumber": 883,
      "values": [
        {
          "date": "19890405",
          "value": "2"
        },
        {
          "date": "19890419",
          "value": "2"
        },
        {
          "date": "19890517",
          "value": "1"
        }
      ]
    },
    {
      "bdsNumber": 884,
      "values": [
        {
          "date": "19890405",
          "value": "1"
        },
        {
          "date": "19890419",
          "value": "1"
        },
        {
          "date": "19890517",
          "value": "1"
        }
      ]
    },
    {
      "bdsNumber": 885,
      "values": [
        {
          "date": "19890405",
          "value": "1"
        },
        {
          "date": "19890419",
          "value": "1"
        },
        {
          "date": "19890517",
          "value": "1"
        }
      ]
    },
    {
      "bdsNumber": 886,
      "values": [
        {
          "date": "19890419",
          "value": "2"
        },
        {
          "date": "19890517",
          "value": "3"
        }
      ]
    },
    {
      "bdsNumber": 887,
      "values": [
        {
          "date": "19890816",
          "value": "1"
        }
      ]
    },
    {
      "bdsNumber": 888,
      "values": [
        {
          "date": "19890816",
          "value": "1"
        }
      ]
    },
    {
      "bdsNumber": 889,
      "values": [
        {
          "date": "19890816",
          "value": "1"
        }
      ]
    },
    {
      "bdsNumber": 890,
      "values": [
        {
          "date": "19890816",
          "value": "2"
        },
        {
          "date": "19891115",
          "value": "1"
        }
      ]
    },
    {
      "bdsNumber": 891,
      "values": [
        {
          "date": "19890816",
          "value": "2"
        },
        {
          "date": "19891115",
          "value": "1"
        }
      ]
    },
    {
      "bdsNumber": 892,
      "values": [
        {
          "date": "19890816",
          "value": "3"
        },
        {
          "date": "19891115",
          "value": "3"
        }
      ]
    },
    {
      "bdsNumber": 893,
      "values": [
        {
          "date": "19890816",
          "value": "3"
        },
        {
          "date": "19891115",
          "value": "3"
        }
      ]
    },
    {
      "bdsNumber": 894,
      "values": [
        {
          "date": "19891115",
          "value": "2"
        },
        {
          "date": "19900221",
          "value": "1"
        }
      ]
    },
    {
      "bdsNumber": 896,
      "values": [
        {
          "date": "19891115",
          "value": "2"
        },
        {
          "date": "19900221",
          "value": "1"
        }
      ]
    },
    {
      "bdsNumber": 897,
      "values": [
        {
          "date": "19900221",
          "value": "1"
        }
      ]
    },
    {
      "bdsNumber": 898,
      "values": [
        {
          "date": "19900221",
          "value": "1"
        }
      ]
    },
    {
      "bdsNumber": 900,
      "values": [
        {
          "date": "19900221",
          "value": "1"
        }
      ]
    },
    {
      "bdsNumber": 902,
      "values": [
        {
          "date": "19900523",
          "value": "1"
        },
        {
          "date": "19900821",
          "value": "1"
        }
      ]
    },
    {
      "bdsNumber": 903,
      "values": [
        {
          "date": "19900523",
          "value": "1"
        },
        {
          "date": "19900821",
          "value": "1"
        }
      ]
    },
    {
      "bdsNumber": 905,
      "values": [
        {
          "date": "19900523",
          "value": "3"
        },
        {
          "date": "19900821",
          "value": "1"
        }
      ]
    },
    {
      "bdsNumber": 906,
      "values": [
        {
          "date": "19900821",
          "value": "1"
        },
        {
          "date": "19910219",
          "value": "1"
        }
      ]
    },
    {
      "bdsNumber": 909,
      "values": [
        {
          "date": "19900821",
          "value": "3"
        },
        {
          "date": "19910219",
          "value": "3"
        }
      ]
    },
    {
      "bdsNumber": 910,
      "values": [
        {
          "date": "19910219",
          "value": "2"
        }
      ]
    },
    {
      "bdsNumber": 912,
      "values": [
        {
          "date": "19910219",
          "value": "2"
        }
      ]
    },
    {
      "bdsNumber": 921,
      "values": [
        {
          "date": "19910219",
          "value": "3"
        }
      ]
    },
    {
      "bdsNumber": 927,
      "values": [
        {
          "date": "19890405",
          "value": "1"
        }
      ]
    },
    {
      "bdsNumber": 928,
      "values": [
        {
          "date": "19890405",
          "value": "2"
        },
        {
          "date": "19890419",
          "value": "2"
        },
        {
          "date": "19890517",
          "value": "3"
        }
      ]
    },
    {
      "bdsNumber": 930,
      "values": [
        {
          "date": "19890419",
          "value": "2"
        },
        {
          "date": "19890517",
          "value": "3"
        }
      ]
    },
    {
      "bdsNumber": 932,
      "values": [
        {
          "date": "19890816",
          "value": "2"
        },
        {
          "date": "19891115",
          "value": "3"
        }
      ]
    },
    {
      "bdsNumber": 933,
      "values": [
        {
          "date": "19891115",
          "value": "3"
        },
        {
          "date": "19900221",
          "value": "3"
        }
      ]
    },
    {
      "bdsNumber": 935,
      "values": [
        {
          "date": "19891115",
          "value": "2"
        },
        {
          "date": "19900221",
          "value": "3"
        }
      ]
    },
    {
      "bdsNumber": 936,
      "values": [
        {
          "date": "19900221",
          "value": "2"
        },
        {
          "date": "19900523",
          "value": "2"
        },
        {
          "date": "19900821",
          "value": "3"
        }
      ]
    },
    {
      "bdsNumber": 937,
      "values": [
        {
          "date": "19900221",
          "value": "3"
        }
      ]
    },
    {
      "bdsNumber": 938,
      "values": [
        {
          "date": "19900523",
          "value": "2"
        },
        {
          "date": "19900821",
          "value": "2"
        },
        {
          "date": "19910219",
          "value": "3"
        }
      ]
    },
    {
      "bdsNumber": 940,
      "values": [
        {